Symbol,Name,Last Sale,Net Change,% Change,Market Cap,Country,IPO Year,Volume,Sector,Industry
RDIB,Reading International Inc Class B Common Stock,$18.23,-0.27,-1.459%,406044520.00,United States,,4284,Consumer Discretionary,Movies/Entertainment
RDNT,RadNet Inc. Common Stock,$31.64,0.15,0.476%,2144325918.00,United States,,345344,Health Care,Medical Specialities
RDVT,Red Violet Inc. Common Stock ,$21.12,0.345,1.661%,293852930.00,United States,,9393,Technology,Computer Software: Prepackaged Software
REAL,The RealReal Inc. Common Stock,$2.48,-0.13,-4.981%,253312061.00,United States,2019,3746315,Consumer Discretionary,Consumer Specialties
REFI,Chicago Atlantic Real Estate Finance Inc. Common Stock,$14.91,-0.09,-0.60%,270995110.00,United States,2021,84813,Real Estate,Real Estate Investment Trusts
REFR,Research Frontiers Incorporated Common Stock,$1.62,0.02,1.25%,54285045.00,United States,,17481,Technology,Industrial Machinery/Components
REG,Regency Centers Corporation Common Stock,$64.21,-0.66,-1.017%,10980116564.00,United States,1993,744380,Real Estate,Real Estate Investment Trusts
REGN,Regeneron Pharmaceuticals Inc. Common Stock,$808.38,1.43,0.177%,87756696457.00,United States,1991,354471,Health Care,Biotechnology: Pharmaceutical Preparations
REKR,Rekor Systems Inc. Common Stock,$2.73,0.10,3.802%,168734980.00,United States,,609354,Telecommunications,Telecommunications Equipment
RELL,Richardson Electronics Ltd. Common Stock,$12.28,-0.33,-2.617%,174820069.00,United States,1983,143717,Technology,Electronic Components
RELY,Remitly Global Inc. Common Stock,$23.11,-0.68,-2.858%,4187500709.00,United States,2021,933084,Technology,Computer Software: Prepackaged Software
RENB,Renovaro Biosciences Inc. Common Stock,$1.83,0.27,17.308%,106658972.00,United States,,921557,Health Care,Biotechnology: Pharmaceutical Preparations
RENT,Rent the Runway Inc. Class A Common Stock,$1.53,-0.02,-1.29%,103002245.00,United States,2021,309005,Consumer Discretionary,Other Specialty Stores
REPL,Replimune Group Inc. Common Stock,$19.69,-0.25,-1.254%,1161637659.00,United States,2018,437319,Health Care,Biotechnology: Pharmaceutical Preparations
RETA,Reata Pharmaceuticals Inc. Class A Common Stock,$169.27,1.79,1.069%,6457656255.00,United States,2016,1366637,Health Care,Biotechnology: Pharmaceutical Preparations
REYN,Reynolds Consumer Products Inc. Common Stock,$28.29,-0.30,-1.049%,5941161145.00,United States,2020,182463,Industrials,Office Equipment/Supplies/Services
RGCO,RGC Resources Inc. Common Stock,$19.00,0.37,1.986%,190022743.00,United States,,23967,Utilities,Oil & Gas Production
RGEN,Repligen Corporation Common Stock,$174.83,2.62,1.521%,9747877775.00,United States,1986,308053,Health Care,Medical/Dental Instruments
RGF,The Real Good Food Company Inc. Class A Common Stock,$4.13,0.03,0.732%,106825060.00,United States,2021,95397,Consumer Staples,Packaged Foods
RGLD,Royal Gold Inc. Common Stock,$112.97,-0.80,-0.703%,7420856280.00,United States,,319227,Industrials,Precious Metals
RGNX,REGENXBIO Inc. Common Stock,$18.24,0.34,1.899%,801832370.00,United States,2015,268917,Health Care,Biotechnology: Biological Products (No Diagnostic Substances)
RGP,Resources Connection Inc. Common Stock,$16.30,0.04,0.246%,548868775.00,United States,,93551,Consumer Discretionary,Business Services
RICK,RCI Hospitality Holdings Inc. Common Stock,$67.01,-0.30,-0.446%,631219793.00,United States,1995,88759,Consumer Discretionary,Restaurants
RIGL,Rigel Pharmaceuticals Inc. Common Stock,$1.185,0.025,2.155%,206621679.00,United States,2000,1365560,Health Care,Biotechnology: Pharmaceutical Preparations
RILY,B. Riley Financial Inc. Common Stock,$52.66,0.48,0.92%,1609909882.00,United States,,153270,Finance,Investment Managers
RILYG,B. Riley Financial Inc. 5.00% Senior Notes due 2026,$20.21,-0.21,-1.028%,617855654.00,United States,,72181,Finance,Investment Managers
RILYK,B. Riley Financial Inc. 5.50% Senior Notes Due 2026,$22.19,-0.02,-0.09%,678387776.00,United States,,5614,Finance,Investment Managers
RILYL,B. Riley Financial Inc. Depositary Shares each representing 1/1000th in a share of 7.375% Series B Cumulative Perpetual Preferred Stock par value $0.0001,$23.50,-0.005,-0.021%,718436807.00,United States,,1616,Finance,Investment Managers
RILYM,B. Riley Financial Inc. 6.375% Senior Notes due 2025,$23.50,0.09,0.384%,718436807.00,United States,,6216,Finance,Investment Managers
RILYN,B. Riley Financial Inc. 6.50% Senior Notes Due 2026,$21.42,0.01,0.047%,654847506.00,United States,,37639,Finance,Investment Managers
RILYO,B. Riley Financial Inc. 6.75% Senior Notes due 2024,$24.72,0.07,0.284%,755734377.00,United States,,12943,Finance,Investment Managers
RILYP,B. Riley Financial Inc. Depositary Shares each representing a 1/1000th fractional interest in a share of Series A Cumulative Perpetual Preferred Stock,$21.2913,0.0914,0.431%,650912918.00,United States,,1102,Finance,Investment Managers
RILYT,B. Riley Financial Inc. 6.00% Senior Notes Due 2028,$20.10,-0.06,-0.298%,614492758.00,United States,,9766,Finance,Investment Managers
RILYZ,B. Riley Financial Inc. 5.25% Senior Notes due 2028,$18.65,-0.05,-0.267%,570163678.00,United States,,15807,Finance,Investment Managers
RIOT,Riot Platforms Inc. Common Stock ,$14.66,-0.57,-3.743%,2716583482.00,United States,,17366791,Technology,Retail: Computer Software & Peripheral Equipment
RIVN,Rivian Automotive Inc. Class A Common Stock,$21.56,-0.01,-0.046%,20441820590.00,United States,2021,33997042,Consumer Discretionary,Auto Manufacturing
RKDA,Arcadia Biosciences Inc. Common Stock,$4.21,-0.09,-2.093%,60666702.00,United States,2015,8814,Industrials,Agricultural Chemicals
RKLB,Rocket Lab USA Inc. Common Stock,$6.31,-0.01,-0.158%,3049790934.00,United States,2020,2358912,Industrials,Aerospace
RLAY,Relay Therapeutics Inc. Common Stock,$11.15,0.42,3.914%,1361790933.00,United States,2020,892676,Health Care,Biotechnology: Biological Products (No Diagnostic Substances)
RLMD,Relmada Therapeutics Inc. Common Stock,$3.18,0.08,2.581%,95715466.00,United States,,154523,Health Care,Biotechnology: Pharmaceutical Preparations
RLYB,Rallybio Corporation Common Stock,$6.00,0.20,3.448%,226805136.00,United States,2021,51211,Health Care,Biotechnology: Pharmaceutical Preparations
RMBI,Richmond Mutual Bancorporation Inc. Common Stock,$11.605,-0.115,-0.981%,132564785.00,United States,2019,3772,Finance,Major Banks
RMBL,RumbleOn Inc. Class B Common Stock,$7.20,-0.26,-3.485%,120398357.00,United States,,325109,Technology,EDP Services
RMBS,Rambus Inc. Common Stock,$54.69,2.39,4.57%,5968400422.00,United States,1997,1542890,Technology,Semiconductors
RMNI,Rimini Street Inc. (DE) Common Stock,$2.57,-0.16,-5.861%,228953590.00,United States,2015,415668,Consumer Discretionary,Business Services
RMR,The RMR Group Inc. Class A Common Stock,$23.94,0.69,2.968%,756795565.00,United States,,120520,Consumer Discretionary,Professional Services
RNA,Avidity Biosciences Inc. Common Stock,$8.77,-0.10,-1.127%,649823735.00,United States,2020,632729,Health Care,Biotechnology: Pharmaceutical Preparations
RNST,Renasant Corporation Common Stock,$30.60,-0.32,-1.035%,1717788008.00,United States,,174780,Finance,Major Banks
ROAD,Construction Partners Inc. Class A Common Stock,$35.24,0.07,0.199%,1858093172.00,United States,2018,217163,Industrials,Military/Government/Technical
ROCK,Gibraltar Industries Inc. Common Stock,$72.42,0.15,0.208%,2203281240.00,United States,1993,200428,Industrials,Steel/Iron Ore
ROIC,Retail Opportunity Investments Corp. Common Stock (MD),$14.38,-0.30,-2.044%,1811934572.00,United States,,698896,Real Estate,Real Estate Investment Trusts
ROKU,Roku Inc. Class A Common Stock,$82.26,3.00,3.785%,11640430888.00,United States,2017,5496899,Telecommunications,Cable & Other Pay Television Services
ROOT,Root Inc. Class A Common Stock,$9.30,-0.10,-1.064%,134850000.00,United States,2020,98922,Finance,Property-Casualty Insurers
ROP,Roper Technologies Inc. Common Stock,$496.21,7.10,1.452%,52951015193.00,United States,1992,376695,Industrials,Office Equipment/Supplies/Services
ROSE,Rose Hill Acquisition Corporation Class A Ordinary Shares,$11.40,-0.18,-1.554%,60285822.00,United States,2021,25222,Finance,Blank Checks
ROST,Ross Stores Inc. Common Stock,$114.12,0.73,0.644%,39606807078.00,United States,1985,2063737,Consumer Discretionary,Clothing/Shoe/Accessory Stores
ROVR,Rover Group Inc. Class A Common Stock,$6.32,0.06,0.958%,1149479243.00,United States,2021,946998,Consumer Discretionary,Other Consumer Services
RPAY,Repay Holdings Corporation Class A Common Stock,$9.05,0.23,2.608%,857042837.00,United States,2018,482718,Consumer Discretionary,Business Services
RPD,Rapid7 Inc. Common Stock,$50.54,-0.36,-0.707%,3081244989.00,United States,2015,1193093,Technology,Computer Software: Prepackaged Software
RPHM,Reneo Pharmaceuticals Inc. Common Stock,$5.70,-0.52,-8.36%,192664492.00,United States,2021,154970,Health Care,Biotechnology: Pharmaceutical Preparations
RPRX,Royalty Pharma plc Class A Ordinary Shares ,$30.11,-0.36,-1.181%,18120879992.00,United States,2020,2382116,Health Care,Biotechnology: Pharmaceutical Preparations
RRBI,Red River Bancshares Inc. Common Stock,$49.95,-0.01,-0.02%,358394047.00,United States,2019,5963,Consumer Discretionary,Hotels/Resorts
RRGB,Red Robin Gourmet Burgers Inc. Common Stock,$12.58,-0.18,-1.411%,202802180.00,United States,2002,521387,Consumer Discretionary,Restaurants
RRR,Red Rock Resorts Inc. Class A Common Stock,$44.61,0.25,0.564%,4656242223.00,United States,2016,276441,Consumer Discretionary,Hotels/Resorts
RSSS,Research Solutions Inc Common Stock,$2.14,-0.02,-0.926%,63131635.00,United States,,7067,Consumer Discretionary,Business Services
RSVR,Reservoir Media Inc. Common Stock,$5.35,-0.01,-0.187%,346174120.00,United States,2021,362612,Consumer Discretionary,Movies/Entertainment
RTL,The Necessity Retail REIT Inc. Class A Common Stock,$7.33,-0.06,-0.812%,986131097.00,United States,,476445,Real Estate,Real Estate Investment Trusts
RTLPO,The Necessity Retail REIT Inc. 7.375% Series C Cumulative Redeemable Preferred Stock,$20.78,0.12,0.581%,2795607668.00,United States,,2255,Real Estate,Real Estate Investment Trusts
RTLPP,The Necessity Retail REIT Inc. 7.50% Series A Cumulative Redeemable Perpetual Preferred Stock,$20.56,-0.19,-0.916%,2766010281.00,United States,,13269,Real Estate,Real Estate Investment Trusts
RUM,Rumble Inc. Class A Common Stock,$8.24,0.02,0.243%,3171677822.00,United States,2021,2166024,Technology,Computer Software: Prepackaged Software
RUMBW,Rumble Inc. Warrant,$2.15,0.15,7.50%,827561568.00,United States,2021,33447,Technology,Computer Software: Prepackaged Software
RUN,Sunrun Inc. Common Stock,$16.77,0.13,0.781%,3642164897.00,United States,2015,8001824,Miscellaneous,Industrial Machinery/Components
RUSHA,Rush Enterprises Inc. Common Stock Cl A,$63.48,-0.13,-0.204%,3417547685.00,United States,,205128,Consumer Discretionary,Retail-Auto Dealers and Gas Stations
RUSHB,Rush Enterprises Inc. Class B,$67.27,-0.50,-0.738%,3621588418.00,United States,,11183,Consumer Discretionary,Retail-Auto Dealers and Gas Stations
RVMD,Revolution Medicines Inc. Common Stock,$30.00,0.01,0.033%,3275096910.00,United States,2020,881049,Health Care,Biotechnology: Biological Products (No Diagnostic Substances)
RVNC,Revance Therapeutics Inc. Common Stock,$19.46,0.55,2.909%,1711611247.00,United States,2014,2261501,Health Care,Biotechnology: Pharmaceutical Preparations
RVPH,Reviva Pharmaceuticals Holdings Inc. Common Stock ,$4.17,0.04,0.969%,86047041.00,United States,2020,71006,Health Care,Biotechnology: Pharmaceutical Preparations
RVSB,Riverview Bancorp Inc Common Stock,$5.86,0.02,0.342%,125968523.00,United States,,3033,Finance,Major Banks
RVYL,Ryvyl Inc. Common Stock,$1.155,0.065,5.963%,59302113.00,United States,,262425,Consumer Discretionary,Professional Services
RWAY,Runway Growth Finance Corp. Common Stock,$13.13,0.03,0.229%,531886702.00,United States,2021,168556,,
RWAYL,Runway Growth Finance Corp. 7.50% Notes due 2027,$24.45,0.1488,0.612%,990451627.00,United States,,4339,,
RWAYZ,Runway Growth Finance Corp. 8.00% Notes due 2027,$24.54,0.14,0.574%,994097461.00,United States,,14574,,
RXRX,Recursion Pharmaceuticals Inc. Class A Common Stock,$9.32,-0.25,-2.612%,2009282695.00,United States,2021,5160217,Health Care,Biotechnology: Pharmaceutical Preparations
RXST,RxSight Inc. Common Stock,$29.56,1.39,4.934%,1053626856.00,United States,2021,457912,Health Care,Biotechnology: Electromedical & Electrotherapeutic Apparatus
RXT,Rackspace Technology Inc. Common Stock,$2.22,-0.05,-2.203%,479278895.00,United States,2020,939642,Technology,EDP Services
RYTM,Rhythm Pharmaceuticals Inc. Common Stock,$26.44,-0.19,-0.713%,1504476453.00,United States,2017,523618,Health Care,Biotechnology: Pharmaceutical Preparations
RZLT,Rezolute Inc. Common Stock (NV),$1.43,-0.03,-2.055%,52663421.00,United States,,46670,Health Care,Biotechnology: Pharmaceutical Preparations
SABR,Sabre Corporation Common Stock,$5.515,-0.125,-2.216%,1832809033.00,United States,2014,6118399,Technology,Computer Software: Programming Data Processing
SABRP,Sabre Corporation 6.50% Series A Mandatory Convertible Preferred Stock,$77.34,-2.725,-3.403%,25702529579.00,United States,,6007,Technology,Computer Software: Programming Data Processing
SAFT,Safety Insurance Group Inc. Common Stock,$70.58,-0.73,-1.024%,1044012796.00,United States,2002,38649,Finance,Property-Casualty Insurers
SAGE,Sage Therapeutics Inc. Common Stock,$21.63,-0.14,-0.643%,1295289687.00,United States,2014,1819626,Health Care,Biotechnology: Pharmaceutical Preparations
SAIA,Saia Inc. Common Stock,$426.07,1.61,0.379%,11305930209.00,United States,,211047,Industrials,Trucking Freight/Courier Services
SAMA,Schultze Special Purpose Acquisition Corp. II Class A Common Stock,$10.57,0.00,0.00%,218006250.00,United States,2021,116268,Finance,Blank Checks
SAMG,Silvercrest Asset Management Group Inc. Class A Common Stock,$20.16,0.02,0.099%,280280710.00,United States,2013,12220,Finance,Investment Managers
SANA,Sana Biotechnology Inc. Common Stock,$5.40,-0.06,-1.099%,1063487151.00,United States,2021,891536,Health Care, Medicinal Chemicals and Botanical Products 
SANM,Sanmina Corporation Common Stock,$55.15,0.01,0.018%,3156066237.00,United States,1993,305192,Technology,Electrical Products
SASR,Sandy Spring Bancorp Inc. Common Stock,$23.84,-0.59,-2.415%,1069518877.00,United States,,116709,Finance,Major Banks
SATS,EchoStar  Corporation Common Stock,$23.25,0.24,1.043%,1949496713.00,United States,,1610934,Consumer Discretionary,Telecommunications Equipment
SAVA,Cassava Sciences Inc. Common Stock,$18.29,0.37,2.065%,767631190.00,United States,,1577707,Health Care,Biotechnology: Pharmaceutical Preparations
SBAC,SBA Communications Corporation Class A Common Stock,$231.02,0.96,0.417%,25038576898.00,United States,1999,837970,Real Estate,Real Estate Investment Trusts
SBCF,Seacoast Banking Corporation of Florida Common Stock,$23.00,-0.46,-1.961%,1956984187.00,United States,,430504,Finance,Major Banks
SBFG,SB Financial Group Inc. Common Stock,$13.98,0.08,0.576%,95715636.00,United States,,474,Finance,Major Banks
SBGI,Sinclair Inc. Class A Common Stock,$14.39,0.24,1.696%,912675893.00,United States,1995,496288,Industrials,Broadcasting
SBRA,Sabra Health Care REIT Inc. Common Stock,$12.61,-0.06,-0.474%,2915667277.00,United States,,1979719,Real Estate,Real Estate Investment Trusts
SBSI,Southside Bancshares Inc. Common Stock,$32.24,-0.42,-1.286%,984345393.00,United States,,85303,Finance,Major Banks
SBT,Sterling Bancorp Inc. Common Stock,$6.16,-0.02,-0.324%,320788665.00,United States,2017,22076,Finance,Savings Institutions
SBUX,Starbucks Corporation Common Stock,$101.01,0.02,0.02%,115696854000.00,United States,1992,3239300,Consumer Discretionary,Restaurants
SCHL,Scholastic Corporation Common Stock,$45.18,-0.63,-1.375%,1428118746.00,United States,1992,187509,Consumer Discretionary,Books
SCHN,Schnitzer Steel Industries Inc. Class A Common Stock,$32.35,0.76,2.406%,888167891.00,United States,1993,145990,Consumer Discretionary,Industrial Specialties
SCLX,Scilex Holding Company Common Stock,$3.64,-0.35,-8.772%,542561550.00,United States,2021,507461,Health Care,Biotechnology: Pharmaceutical Preparations
SCLXW,Scilex Holding Company Warrant,$1.06,-0.12,-10.169%,157998693.00,United States,2021,51914,Health Care,Biotechnology: Pharmaceutical Preparations
SCOR,comScore Inc. Common Stock,$0.80,0.0096,1.215%,76069067.00,United States,2018,288807,Consumer Discretionary,Business Services
SCPH,scPharmaceuticals Inc. Common Stock,$7.80,-0.05,-0.637%,279684951.00,United States,2017,383135,Health Care,Biotechnology: Pharmaceutical Preparations
SCPL,SciPlay Corporation Class A Common Stock,$22.68,0.00,0.00%,2829690998.00,United States,2019,606390,Technology,EDP Services
SCSC,ScanSource Inc. Common Stock,$28.41,-0.52,-1.797%,707402096.00,United States,,93852,Technology,Retail: Computer Software & Peripheral Equipment
SCTL,Societal CDMO Inc. Common Stock,$0.74,-0.048,-6.091%,62842806.00,United States,2014,114425,Health Care,Biotechnology: Pharmaceutical Preparations
SCVL,Shoe Carnival Inc. Common Stock,$25.14,-0.07,-0.278%,687216858.00,United States,1993,299936,Consumer Discretionary,Clothing/Shoe/Accessory Stores
SCWO,374Water Inc. Common Stock,$1.80,0.07,4.046%,238800793.00,United States,,156592,Consumer Discretionary,Metal Fabrications
SCWX,SecureWorks Corp. Class A Common Stock,$6.90,-0.04,-0.576%,591540271.00,United States,2016,33274,Technology,EDP Services
SCYX,SCYNEXIS Inc. Common Stock,$2.80,-0.19,-6.355%,102248838.00,United States,2014,167176,Health Care,Biotechnology: Pharmaceutical Preparations
SDC,SmileDirectClub Inc. Class A Common Stock,$0.6017,0.0617,11.426%,242249030.00,United States,2019,2521409,Health Care,Medical/Dental Instruments
SDGR,Schrodinger Inc. Common Stock,$36.69,-0.98,-2.602%,2637289785.00,United States,2020,814373,Health Care,Biotechnology: Pharmaceutical Preparations
SDIG,Stronghold Digital Mining Inc. Class A Common Stock,$7.22,-0.29,-3.862%,53410708.00,United States,2021,387666,Finance,Investment Bankers/Brokers/Service
SEAT,Vivid Seats Inc. Class A Common Stock,$7.53,0.08,1.074%,1477266981.00,United States,,604737,Industrials,Industrial Machinery/Components
SEATW,Vivid Seats Inc. Warrant,$1.90,-0.05,-2.564%,372749969.00,United States,,398,Industrials,Industrial Machinery/Components
SEEL,Seelos Therapeutics Inc. Common Stock,$1.33,-0.11,-7.639%,169395927.00,United States,,1403767,Health Care,Biotechnology: Pharmaceutical Preparations
SEER,Seer Inc. Class A Common Stock,$2.81,0.06,2.182%,179671319.00,United States,2020,418261,Health Care, Medicinal Chemicals and Botanical Products 
SEIC,SEI Investments Company Common Stock,$61.98,0.14,0.226%,8203552249.00,United States,1981,360769,Finance,Investment Bankers/Brokers/Service
SELB,Selecta Biosciences Inc. Common Stock,$1.04,-0.06,-5.455%,159564062.00,United States,2016,559407,Health Care,Biotechnology: Pharmaceutical Preparations
SELF,Global Self Storage Inc. Common Stock,$5.02,-0.08,-1.569%,55942418.00,United States,,24918,Real Estate,Real Estate Investment Trusts
SENEA,Seneca Foods Corp. Class A Common Stock,$48.16,-0.15,-0.31%,365709510.00,United States,,78456,Consumer Staples,Packaged Foods
SENEB,Seneca Foods Corp. Class B Common Stock,$41.00,0.00,0.00%,311339076.00,United States,,73,Consumer Staples,Packaged Foods
SERA,Sera Prognostics Inc. Class A Common Stock,$2.32,-0.21,-8.30%,72575412.00,United States,2021,52864,Health Care,Precision Instruments
SEVN,Seven Hills Realty Trust Common Stock,$10.57,0.21,2.027%,155852821.00,United States,,80218,Real Estate,Real Estate Investment Trusts
SFBC,Sound Financial Bancorp Inc. Common Stock,$37.63,0.31,0.831%,97880785.00,United States,,535,Finance,Savings Institutions
SFIX,Stitch Fix Inc. Class A Common Stock,$4.05,-0.17,-4.028%,460757476.00,United States,2017,1604165,Consumer Discretionary,Catalog/Specialty Distribution
SFM,Sprouts Farmers Market Inc. Common Stock,$38.46,-0.02,-0.052%,3923157106.00,United States,2013,1270521,Consumer Staples,Food Chains
SFNC,Simmons First National Corporation Class A Common Stock,$18.83,-0.38,-1.978%,2377505683.00,United States,,359999,Finance,Major Banks
SFST,Southern First Bancshares Inc. Common Stock,$28.55,-0.66,-2.26%,230582305.00,United States,,16198,Finance,Major Banks
SGA,Saga Communications Inc. Class A Common Stock (FL),$21.28,0.03,0.141%,130308697.00,United States,,5255,Consumer Discretionary,Broadcasting
SGC,Superior Group of Companies Inc. Common Stock,$8.72,0.54,6.601%,143865281.00,United States,,37516,Consumer Discretionary,Apparel
SGEN,Seagen Inc. Common Stock,$194.30,-0.38,-0.195%,36469708771.00,United States,2001,748216,Health Care,Biotechnology: Biological Products (No Diagnostic Substances)
SGH,SMART Global Holdings Inc. Ordinary Shares,$24.65,0.45,1.86%,1209618416.00,United States,2017,490986,Technology,Semiconductors
SGHT,Sight Sciences Inc. Common Stock,$7.62,0.02,0.263%,370721184.00,United States,2021,62970,Health Care,Medical Specialities
SGMO,Sangamo Therapeutics Inc. Common Stock,$1.02,-0.06,-5.556%,180653952.00,United States,2000,2734110,Health Care,Biotechnology: Biological Products (No Diagnostic Substances)
SGRY,Surgery Partners Inc. Common Stock,$34.18,-0.39,-1.128%,4323733086.00,United States,2015,748266,Health Care,Hospital/Nursing Management
SHBI,Shore Bancshares Inc Common Stock,$11.39,-0.01,-0.088%,226631500.00,United States,,70747,Finance,Major Banks
SHC,Sotera Health Company Common Stock,$16.84,-0.17,-0.999%,4759248775.00,United States,2020,526036,Health Care,Medical Specialities
SHCR,Sharecare Inc. Class A Common Stock,$1.16,-0.08,-6.452%,414265407.00,United States,2021,509159,Technology,Computer Software: Prepackaged Software
SHEN,Shenandoah Telecommunications Co Common Stock,$22.93,0.23,1.013%,1152552442.00,United States,,236282,Telecommunications,Telecommunications Equipment
SHLS,Shoals Technologies Group Inc. Class A Common Stock,$21.62,-0.03,-0.139%,3674092012.00,United States,2021,1725113,Technology,Semiconductors
SHOO,Steven Madden Ltd. Common Stock,$34.88,-0.10,-0.286%,2626971469.00,United States,1993,802498,Consumer Discretionary,Shoe Manufacturing
SHYF,The Shyft Group Inc. Common Stock,$15.50,-0.09,-0.577%,541896895.00,United States,,423900,Consumer Discretionary,Auto Manufacturing
SIBN,SI-BONE Inc. Common Stock,$21.30,-0.23,-1.068%,856198976.00,United States,2018,412368,Health Care,Medical/Dental Instruments
SIEB,Siebert Financial Corp. Common Stock,$2.27,-0.04,-1.732%,89848725.00,United States,,16999,Finance,Investment Bankers/Brokers/Service
SIGA,SIGA Technologies Inc. Common Stock,$4.99,-0.07,-1.383%,354703891.00,United States,,593856,Health Care,Biotechnology: Pharmaceutical Preparations
SIGI,Selective Insurance Group Inc. Common Stock,$100.60,0.48,0.479%,6093025714.00,United States,,140139,Finance,Property-Casualty Insurers
SIGIP,Selective Insurance Group Inc. Depositary Shares each representing a 1/1000th interest in a share of 4.60% Non-Cumulative Preferred Stock Series B,$17.2358,0.0258,0.15%,1043918217.00,United States,,2050,Finance,Property-Casualty Insurers
SILK,Silk Road Medical Inc. Common Stock,$19.92,0.17,0.861%,773553201.00,United States,2019,341318,Health Care,Medical/Dental Instruments
SIRI,Sirius XM Holdings Inc. Common Stock,$4.70,-0.05,-1.053%,18059294330.00,United States,,7987007,Consumer Discretionary,Broadcasting
SITM,SiTime Corporation Common Stock,$132.16,-0.84,-0.632%,2935300825.00,United States,2019,147111,Technology,Semiconductors
SKIN,The Beauty Health Company Class A Common Stock,$6.56,-0.43,-6.152%,871730632.00,United States,2020,2477869,Consumer Discretionary,Package Goods/Cosmetics
SKWD,Skyward Specialty Insurance Group Inc. Common Stock,$25.08,0.27,1.088%,944865500.00,United States,2023,706864,Finance,Property-Casualty Insurers
SKYT,SkyWater Technology Inc. Common Stock,$7.59,0.56,7.966%,351292160.00,United States,2021,534886,Technology,Semiconductors
SKYW,SkyWest Inc. Common Stock,$42.19,0.18,0.428%,1774629363.00,United States,1986,271441,Consumer Discretionary,Air Freight/Delivery Services
SKYX,SKYX Platforms Corp. Common Stock,$2.04,-0.01,-0.488%,187378912.00,United States,2022,82855,Consumer Discretionary,Building Products
SLAB,Silicon Laboratories Inc. Common Stock,$140.18,3.49,2.553%,4466746546.00,United States,2000,264910,Technology,Semiconductors
SLAC,Social Leverage Acquisition Corp I Class A Common Stock,$10.21,-0.115,-1.114%,104931090.00,United States,,1550,Finance,Finance: Consumer Services
SLDB,Solid Biosciences Inc. Common Stock,$3.85,0.05,1.316%,75465925.00,United States,2018,8056,Health Care,Biotechnology: Biological Products (No Diagnostic Substances)
SLDP,Solid Power Inc. Class A Common Stock,$2.35,-0.04,-1.674%,417899795.00,United States,2021,1424258,Energy,Electrical Products
SLDPW,Solid Power Inc. Warrant,$0.3701,-0.0174,-4.49%,66022303.00,United States,2021,26299,Energy,Electrical Products
SLGC,SomaLogic Inc. Class A Common Stock,$2.03,-0.04,-1.932%,381528959.00,United States,2021,1349715,Health Care,Biotechnology: Commercial Physical & Biological Resarch
SLM,SLM Corporation Common Stock,$14.81,-0.31,-2.05%,3348257507.00,United States,,1263553,Finance,Finance: Consumer Services
SLMBP,SLM Corporation Floating Rate Non-Cumulative Preferred Stock Series B,$60.60,0.46,0.765%,13700499995.00,United States,,8521,Finance,Finance: Consumer Services
SLNG,Stabilis Solutions Inc. Common Stock,$4.1572,-0.0828,-1.953%,76820188.00,United States,,1336,Utilities,Oil/Gas Transmission
SLP,Simulations Plus Inc. Common Stock,$48.13,0.51,1.071%,959077798.00,United States,,59506,Technology,EDP Services
SLRC,SLR Investment Corp. Common Stock,$15.31,0.07,0.459%,835231447.00,United States,2010,164759,Finance,Finance/Investors Services
SLRN,ACELYRIN INC. Common Stock,$25.05,0.10,0.401%,2434864760.00,United States,2023,1180466,Health Care,Biotechnology: Pharmaceutical Preparations
SMBC,Southern Missouri Bancorp Inc. Common Stock,$45.43,0.20,0.442%,514754246.00,United States,,12346,Finance,Banks
