Symbol,Name,Last Sale,Net Change,% Change,Market Cap,Country,IPO Year,Volume,Sector,Industry
LANDM,Gladstone Land Corporation 5.00% Series D Cumulative Term Preferred Stock,$23.53,-0.27,-1.134%,843278540.00,United States,,2651,Real Estate,Real Estate Investment Trusts
LANDO,Gladstone Land Corporation 6.00% Series B Cumulative Redeemable Preferred Stock,$19.59,-0.03,-0.153%,702075079.00,United States,,15417,Real Estate,Real Estate Investment Trusts
LARK,Landmark Bancorp Inc. Common Stock,$20.45,-0.16,-0.776%,106764685.00,United States,,2208,Finance,Major Banks
LASR,nLIGHT Inc. Common Stock,$11.01,0.21,1.944%,512080253.00,United States,2018,248569,Technology,Semiconductors
LAUR,Laureate Education Inc. Common Stock,$14.39,0.07,0.489%,2262401556.00,United States,2017,1367111,Consumer Discretionary,Educational Services
LAZR,Luminar Technologies Inc.  Class A Common Stock,$6.36,0.03,0.474%,2482815719.00,United States,2019,3974366,Technology,EDP Services
LAZY,Lazydays Holdings Inc. Common Stock,$12.31,-0.18,-1.441%,171309173.00,United States,,25160,Consumer Discretionary,Retail-Auto Dealers and Gas Stations
LBAI,Lakeland Bancorp Inc. Common Stock,$14.47,-0.36,-2.428%,940976605.00,United States,,146117,Finance,Major Banks
LBC,Luther Burbank Corporation Common Stock,$9.95,-0.07,-0.699%,507727386.00,United States,2017,10547,Finance,Major Banks
LBPH,Longboard Pharmaceuticals Inc. Common Stock,$6.88,-0.05,-0.722%,158095802.00,United States,2021,41285,Health Care,Biotechnology: Pharmaceutical Preparations
LBRDA,Liberty Broadband Corporation Class A Common Stock,$92.96,-0.45,-0.482%,13591969962.00,United States,,101831,Telecommunications,Cable & Other Pay Television Services
LBRDK,Liberty Broadband Corporation Class C Common Stock,$92.59,-0.41,-0.441%,13537871114.00,United States,,925342,Telecommunications,Cable & Other Pay Television Services
LBRDP,Liberty Broadband Corporation Series A Cumulative Redeemable Preferred Stock,$22.10,0.02,0.091%,3231309554.00,United States,,8116,Telecommunications,Cable & Other Pay Television Services
LCA,Landcadia Holdings IV Inc. Class A Common Stock,$10.24,0.01,0.098%,141901179.00,United States,2021,10204,Finance,Blank Checks
LCID,Lucid Group Inc. Common Stock,$6.77,0.13,1.958%,15453542267.00,United States,,25870231,Consumer Discretionary,Auto Manufacturing
LCNB,LCNB Corporation Common Stock,$16.11,-0.55,-3.301%,179162725.00,United States,,10555,Finance,Major Banks
LCUT,Lifetime Brands Inc. Common Stock,$6.85,-0.46,-6.293%,149427517.00,United States,1991,82538,Consumer Discretionary,Industrial Machinery/Components
LE,Lands' End Inc. Common Stock,$9.70,-0.08,-0.818%,315099097.00,United States,,57502,Consumer Discretionary,Clothing/Shoe/Accessory Stores
LECO,Lincoln Electric Holdings Inc. Common Shares,$190.74,1.46,0.771%,10950874174.00,United States,,243921,Industrials,Industrial Machinery/Components
LEE,Lee Enterprises Incorporated Common Stock,$11.29,-0.325,-2.798%,68557306.00,United States,,31767,Consumer Discretionary,Newspapers/Magazines
LEGH,Legacy Housing Corporation Common Stock (TX),$21.26,-0.66,-3.011%,518565331.00,United States,2018,36880,Consumer Discretionary,Homebuilding
LEGN,Legend Biotech Corporation American Depositary Shares,$70.35,-0.93,-1.305%,11612480334.00,United States,2020,603900,Health Care,Biotechnology: Pharmaceutical Preparations
LESL,Leslie's Inc. Common Stock,$7.22,0.23,3.29%,1328515638.00,United States,2020,3644820,Miscellaneous,Diversified Commercial Services
LFCR,Lifecore Biomedical Inc. Common Stock,$9.99,-0.18,-1.77%,302918468.00,United States,,264935,Health Care,Biotechnology: Pharmaceutical Preparations
LFMD,LifeMD Inc. Common Stock,$4.35,-0.03,-0.685%,156742419.00,United States,,306621,Health Care,Medical/Nursing Services
LFMDP,LifeMD Inc. 8.875% Series A Cumulative Perpetual Preferred Stock,$18.72,-0.1079,-0.573%,674532893.00,United States,,2575,Health Care,Medical/Nursing Services
LFST,LifeStance Health Group Inc. Common Stock,$8.04,-0.12,-1.471%,3039162138.00,United States,2021,848890,Health Care,Medical/Nursing Services
LFUS,Littelfuse Inc. Common Stock,$259.98,-0.11,-0.042%,6471294510.00,United States,,64753,Energy,Electrical Products
LFVN,Lifevantage Corporation Common Stock (Delaware),$5.09,0.15,3.036%,65125120.00,United States,,39476,Health Care,Biotechnology: Pharmaceutical Preparations
LGIH,LGI Homes Inc. Common Stock,$134.28,1.22,0.917%,3161762385.00,United States,2013,102961,Consumer Discretionary,Homebuilding
LGND,Ligand Pharmaceuticals Incorporated Common Stock,$67.15,-0.07,-0.104%,1165405508.00,United States,,96389,Health Care,Biotechnology: Pharmaceutical Preparations
LGVC,LAMF Global Ventures Corp. I Class A Ordinary Shares,$10.61,0.029,0.274%,369645323.00,United States,2021,717,,
LGVN,Longeveron Inc. Class A Common Stock,$3.04,-0.23,-7.034%,64348483.00,United States,2021,83400,Health Care, Medicinal Chemicals and Botanical Products 
LIAN,LianBio American Depositary Shares,$1.88,0.03,1.622%,201468649.00,United States,2021,32395,Health Care,Biotechnology: Pharmaceutical Preparations
LIDR,AEye Inc. Class A Common Stock,$0.30,0.0102,3.52%,55442633.00,United States,2021,4832459,Consumer Discretionary,Auto Parts:O.E.M.
LIFE,aTyr Pharma Inc. Common Stock,$1.95,-0.05,-2.50%,111240035.00,United States,2015,168790,Health Care,Biotechnology: Biological Products (No Diagnostic Substances)
LIFW,MSP Recovery Inc. Class A Common Stock,$0.123,0.003,2.50%,422855792.00,United States,2020,2102268,Technology,Computer Software: Prepackaged Software
LIFWZ,MSP Recovery Inc. Warrant,$0.246,0.00,0.00%,845711584.00,United States,2020,200,Technology,Computer Software: Prepackaged Software
LILA,Liberty Latin America Ltd. Class A Common Stock,$9.20,-0.12,-1.288%,1911882093.00,United States,,333247,Telecommunications,Cable & Other Pay Television Services
LILAK,Liberty Latin America Ltd. Class C Common Stock,$9.12,-0.12,-1.299%,1895257032.00,United States,,1484314,Telecommunications,Cable & Other Pay Television Services
LINC,Lincoln Educational Services Corporation Common Stock,$8.63,-0.17,-1.932%,270629119.00,United States,2005,97025,Consumer Discretionary,Other Consumer Services
LIND,Lindblad Expeditions Holdings Inc. Common Stock,$10.78,0.16,1.507%,574887396.00,United States,2013,128155,Consumer Discretionary,Transportation Services
LINK,Interlink Electronics Inc. Common Stock,$9.46,0.21,2.27%,62358305.00,United States,,18647,Technology,Industrial Machinery/Components
LITE,Lumentum Holdings Inc. Common Stock,$50.58,1.05,2.12%,3474846000.00,United States,,1246668,Telecommunications,Telecommunications Equipment
LIVE,Live Ventures Incorporated Common Stock,$26.75,0.1836,0.691%,84645828.00,United States,,3933,Consumer Discretionary,Other Specialty Stores
LKFN,Lakeland Financial Corporation Common Stock,$55.78,-0.62,-1.099%,1418664733.00,United States,,120029,Finance,Major Banks
LKQ,LKQ Corporation Common Stock,$53.46,-0.20,-0.373%,14303563914.00,United States,2003,1343843,Consumer Discretionary,Motor Vehicles
LMAT,LeMaitre Vascular Inc. Common Stock,$56.575,0.755,1.353%,1259537315.00,United States,2006,116366,Health Care,Medical/Dental Instruments
LMB,Limbach Holdings Inc. Common Stock,$32.63,-0.17,-0.518%,359041725.00,United States,,282600,Consumer Discretionary,Engineering & Construction
LMNR,Limoneira Co Common Stock,$15.50,-0.23,-1.462%,278673105.00,United States,,37654,Consumer Staples,Farming/Seeds/Milling
LNKB,LINKBANCORP Inc. Common Stock,$7.00,0.05,0.719%,113651097.00,United States,,4173,,
LNT,Alliant Energy Corporation Common Stock,$51.11,-0.75,-1.446%,12916472792.00,United States,,1346878,Utilities,Power Generation
LNTH,Lantheus Holdings Inc. Common Stock,$69.04,0.04,0.058%,4724455321.00,United States,2015,970691,Health Care,Biotechnology: In Vitro & In Vivo Diagnostic Substances
LNW,Light & Wonder Inc. Common Stock,$75.52,0.91,1.22%,6899270596.00,United States,,644505,Technology,EDP Services
LNZA,LanzaTech Global Inc. Common Stock,$6.69,0.00,0.00%,1309062418.00,United States,2021,153227,Industrials,Major Chemicals
LNZAW,LanzaTech Global Inc. Warrant,$0.53,-0.05,-8.621%,103707486.00,United States,2021,30106,Industrials,Major Chemicals
LOAN,Manhattan Bridge Capital Inc,$4.79,-0.02,-0.416%,54900992.00,United States,,9143,Real Estate,Real Estate Investment Trusts
LOCO,El Pollo Loco Holdings Inc. Common Stock,$10.21,-0.10,-0.97%,362091453.00,United States,2014,240050,Consumer Discretionary,Restaurants
LOGI,Logitech International S.A. Ordinary Shares,$67.96,0.57,0.846%,10787814772.00,United States,1997,326698,Technology,Computer peripheral equipment
LOPE,Grand Canyon Education Inc. Common Stock,$109.67,-0.14,-0.127%,3320246748.00,United States,2008,236813,Consumer Discretionary,Educational Services
LOVE,The Lovesac Company Common Stock,$24.59,0.87,3.668%,374185735.00,United States,2018,311141,Consumer Discretionary,Other Specialty Stores
LPLA,LPL Financial Holdings Inc. Common Stock,$227.45,1.83,0.811%,17353841583.00,United States,2010,289704,Finance,Investment Bankers/Brokers/Service
LPRO,Open Lending Corporation Common Stock,$8.24,-0.03,-0.363%,994551133.00,United States,,470372,Finance,Finance: Consumer Services
LPSN,LivePerson Inc. Common Stock,$4.80,-0.28,-5.512%,374195822.00,United States,2000,1694275,Technology,EDP Services
LPTH,LightPath Technologies Inc. Class A Common Stock,$1.64,-0.01,-0.606%,61214394.00,United States,1996,68632,Technology,Semiconductors
LQDA,Liquidia Corporation Common Stock,$7.02,-0.15,-2.092%,454482494.00,United States,2018,1197776,Health Care,Biotechnology: Pharmaceutical Preparations
LQDT,Liquidity Services Inc. Common Stock,$18.23,0.41,2.301%,559499628.00,United States,2006,59725,Consumer Discretionary,Business Services
LRCX,Lam Research Corporation Common Stock,$667.20,15.23,2.336%,89631964253.00,United States,1984,1301665,Technology,Industrial Machinery/Components
LRFC,Logan Ridge Finance Corporation Common Stock,$21.30,-0.02,-0.094%,57324541.00,United States,2013,6224,Finance,Finance Companies
LRMR,Larimar Therapeutics Inc. Common Stock,$4.23,0.33,8.462%,183063825.00,United States,2014,203139,Health Care,Biotechnology: Pharmaceutical Preparations
LSBK,Lake Shore Bancorp Inc. Common Stock,$10.95,0.26,2.432%,74859828.00,United States,2006,1166,Finance,Savings Institutions
LSCC,Lattice Semiconductor Corporation Common Stock,$88.33,2.93,3.431%,12175133642.00,United States,,1483082,Technology,Semiconductors
LSEA,Landsea Homes Corporation Common Stock,$11.32,-0.40,-3.413%,436853674.00,United States,2018,111721,Consumer Discretionary,Homebuilding
LSTR,Landstar System Inc. Common Stock,$197.63,0.07,0.035%,7104101261.00,United States,1993,133501,Industrials,Trucking Freight/Courier Services
LSXMA,Liberty Media Corporation Series A Liberty SiriusXM Common Stock,$24.14,0.49,2.072%,13545739878.00,United States,,939916,Industrials,Broadcasting
LSXMB,Liberty Media Corporation Series B Liberty SiriusXM Common Stock,$24.73,0.535,2.211%,13876808085.00,United States,,1399,Industrials,Broadcasting
LSXMK,Liberty Media Corporation Series C Liberty SiriusXM Common Stock,$24.30,0.64,2.705%,13635521087.00,United States,,1286485,Industrials,Broadcasting
LTBR,Lightbridge Corporation Common Stock,$5.70,-0.48,-7.767%,71645443.00,United States,,66962,Consumer Discretionary,Professional Services
LTRN,Lantern Pharma Inc. Common Stock,$4.80,-0.10,-2.041%,52171392.00,United States,2020,57527,Health Care,Biotechnology: Pharmaceutical Preparations
LTRPB,Liberty TripAdvisor Holdings Inc. Series B Common Stock,$37.78,0.65,1.751%,2892413905.00,United States,,304,Technology,EDP Services
LTRX,Lantronix Inc. Common Stock,$4.17,-0.08,-1.882%,152703244.00,United States,2000,33750,Telecommunications,Telecommunications Equipment
LUCD,Lucid Diagnostics Inc. Common Stock,$1.485,0.005,0.338%,64932669.00,United States,2021,37160,Health Care,Biotechnology: Electromedical & Electrotherapeutic Apparatus
LUNA,Luna Innovations Incorporated Common Stock,$7.73,0.005,0.065%,262238140.00,United States,2006,289267,Health Care,Biotechnology: Commercial Physical & Biological Resarch
LUNG,Pulmonx Corporation Common Stock,$10.90,0.09,0.833%,414502170.00,United States,2020,105771,Health Care,Industrial Specialties
LUNR,Intuitive Machines Inc. Class A Common Stock,$8.33,-0.16,-1.885%,700606795.00,United States,2021,431501,Industrials,Industrial Machinery/Components
LUXH,LuxUrban Hotels Inc. Common Stock,$2.95,-0.07,-2.318%,105304943.00,United States,2022,47665,Finance,Real Estate
LVLU,Lulu's Fashion Lounge Holdings Inc. Common Stock,$2.12,-0.08,-3.636%,85137438.00,United States,2021,43584,Consumer Discretionary,Catalog/Specialty Distribution
LVO,LiveOne Inc. Common Stock,$1.89,0.20,11.834%,164619289.00,United States,,333098,Consumer Discretionary,Restaurants
LVOX,LiveVox Holdings Inc. Class A Common Stock,$3.17,0.05,1.603%,298623580.00,United States,2021,25492,Technology,EDP Services
LWAY,Lifeway Foods Inc. Common Stock,$7.50,1.20,19.048%,109921163.00,United States,,118692,Consumer Staples,Packaged Foods
LWLG,Lightwave Logic Inc. Common Stock,$6.89,0.20,2.99%,802420693.00,United States,,450721,Industrials,Containers/Packaging
LXRX,Lexicon Pharmaceuticals Inc. Common Stock,$1.70,-0.03,-1.734%,416371982.00,United States,,794191,Health Care,Biotechnology: Pharmaceutical Preparations
LYEL,Lyell Immunopharma Inc. Common Stock,$2.20,-0.11,-4.762%,552259393.00,United States,2021,876913,Health Care,Biotechnology: Pharmaceutical Preparations
LYFT,Lyft Inc. Class A Common Stock,$11.64,0.26,2.285%,4395675311.00,United States,2019,18108388,Technology,EDP Services
LYRA,Lyra Therapeutics Inc. Common Stock,$3.65,0.10,2.817%,180841290.00,United States,2020,132309,Health Care,Medical/Dental Instruments
LYTS,LSI Industries Inc. Common Stock,$12.90,0.11,0.86%,365942724.00,United States,1985,159790,Consumer Discretionary,Building Products
LZ,LegalZoom.com Inc. Common Stock,$12.31,-0.29,-2.302%,2360931798.00,United States,2021,765765,Technology,EDP Services
MACK,Merrimack Pharmaceuticals Inc. Common Stock,$12.29,-0.08,-0.647%,176004512.00,United States,2012,35345,Health Care,Biotechnology: Pharmaceutical Preparations
MAMA,Mama's Creations Inc. Common Stock,$3.54,-0.24,-6.349%,128565214.00,United States,,291575,Consumer Staples,Specialty Foods
MANH,Manhattan Associates Inc. Common Stock,$192.35,0.90,0.47%,11861994065.00,United States,1998,329806,Technology,Computer Software: Prepackaged Software
MAPS,WM Technology Inc. Class A Common Stock ,$1.085,0.025,2.358%,161558675.00,United States,2019,338521,Consumer Discretionary,Other Consumer Services
MAR,Marriott International Class A Common Stock,$206.84,-1.67,-0.801%,61687875348.00,United States,,2477113,Consumer Discretionary,Hotels/Resorts
MARA,Marathon Digital Holdings Inc. Common Stock,$14.99,0.11,0.739%,2612252032.00,United States,,20920225,Technology,EDP Services
MASI,Masimo Corporation Common Stock,$112.84,-0.78,-0.686%,5959991696.00,United States,2007,709966,Health Care,Medical/Dental Instruments
MASS,908 Devices Inc. Common Stock,$7.09,-0.12,-1.664%,229249365.00,United States,2020,155995,Health Care,Medical/Dental Instruments
MAT,Mattel Inc. Common Stock,$21.72,0.12,0.556%,7691909745.00,United States,,1866434,Consumer Discretionary,Recreational Games/Products/Toys
MATW,Matthews International Corporation Class A Common Stock,$43.36,-0.12,-0.276%,1321077824.00,United States,1994,92567,Telecommunications,Metal Fabrications
MAYS,J. W. Mays Inc. Common Stock,$49.77,3.72,8.078%,100325371.00,United States,,1399,Real Estate,Building operators
MBCN,Middlefield Banc Corp. Common Stock,$28.98,0.15,0.52%,234413221.00,United States,,7639,Finance,Major Banks
MBIN,Merchants Bancorp Common Stock,$30.75,-0.42,-1.347%,1329546975.00,United States,2017,36481,Finance,Major Banks
MBINM,Merchants Bancorp Depositary Shares Each Representing a 1/40th Interest in a Share of 8.25% Fixed-Rate Reset Series D Non-Cumulative Perpetual Preferred Stock,$24.69,0.41,1.689%,1067528937.00,United States,,2199,Finance,Major Banks
MBINN,Merchants Bancorp Depositary Shares Preferred Series C,$18.30,0.16,0.882%,791242590.00,United States,,5336,Finance,Major Banks
MBINO,Merchants Bancorp Depositary Shares Each Representing a 1/40th Interest in a Share of Series B  Fixed-to-Floating Rate,$21.9899,0.0299,0.136%,950783903.00,United States,,4114,Finance,Major Banks
MBINP,Merchants Bancorp 7.00% Fixed-to-Floating Rate Series A Non-Cumulative Perpetual Preferred Stock,$23.90,0.0435,0.182%,1033371470.00,United States,,1084,Finance,Major Banks
MBUU,Malibu Boats Inc. Class A Common Stock,$56.39,0.05,0.089%,1163028186.00,United States,2014,70758,Industrials,Marine Transportation
MBWM,Mercantile Bank Corporation Common Stock,$34.73,-0.53,-1.503%,556312642.00,United States,1998,15917,Finance,Major Banks
MCBC,Macatawa Bank Corporation Common Stock,$9.34,-0.06,-0.638%,320282489.00,United States,,35600,Finance,Major Banks
MCBS,MetroCity Bankshares Inc. Common Stock,$21.39,-0.77,-3.475%,540735906.00,United States,2019,14234,Finance,Major Banks
MCFT,MasterCraft Boat Holdings Inc. Common Stock,$27.09,0.20,0.744%,473946783.00,United States,2015,156859,Industrials,Marine Transportation
MCHP,Microchip Technology Incorporated Common Stock,$83.04,1.27,1.553%,45201519109.00,United States,1993,4483380,Technology,Semiconductors
MCHX,Marchex Inc. Class B Common Stock,$1.90,0.00,0.00%,82392693.00,United States,2004,16299,Consumer Discretionary,Business Services
MCRB,Seres Therapeutics Inc. Common Stock,$3.84,-0.03,-0.775%,492305718.00,United States,2015,1977926,Health Care,Biotechnology: Pharmaceutical Preparations
MCRI,Monarch Casino & Resort Inc. Common Stock,$68.01,-0.59,-0.86%,1301992893.00,United States,1993,45541,Consumer Discretionary,Hotels/Resorts
MDB,MongoDB Inc. Class A Common Stock,$364.41,8.19,2.299%,25720559228.00,United States,2017,940744,Technology,Computer Software: Prepackaged Software
MDGL,Madrigal Pharmaceuticals Inc. Common Stock,$173.44,2.01,1.172%,3203650652.00,United States,2007,296704,Health Care,Biotechnology: Pharmaceutical Preparations
MDLZ,Mondelez International Inc. Class A Common Stock,$73.21,-0.76,-1.027%,99596195850.00,United States,,6063949,Consumer Staples,Packaged Foods
MDRX,Veradigm Inc. Common Stock,$13.60,-0.16,-1.163%,1485932954.00,United States,,676665,Technology,EDP Services
MDWT,Midwest Holding Inc. Common Stock,$26.45,-0.185,-0.695%,99045860.00,United States,,10946,Finance,Life Insurance
MDXG,MiMedx Group Inc Common Stock,$7.47,-0.08,-1.06%,867335164.00,United States,,459606,Health Care,Biotechnology: Pharmaceutical Preparations
ME,23andMe Holding Co. Class A Common Stock,$1.355,-0.125,-8.446%,640224805.00,United States,,3671796,Health Care,Precision Instruments
MEDP,Medpace Holdings Inc. Common Stock,$265.62,-1.27,-0.476%,8118083764.00,United States,2016,210593,Health Care,Biotechnology: Commercial Physical & Biological Resarch
MESA,Mesa Air Group Inc. Common Stock,$1.79,0.01,0.562%,72708500.00,United States,2018,293497,Consumer Discretionary,Air Freight/Delivery Services
META,Meta Platforms Inc. Class A Common Stock,$306.19,4.55,1.508%,784682921490.00,United States,2012,15641921,Technology,Computer Software: Programming Data Processing
METC,Ramaco Resources Inc. Class A Common Stock,$8.28,0.10,1.222%,436240039.00,United States,2017,346325,Energy,Coal Mining
METCB,Ramaco Resources Inc. Class B Common Stock,$12.65,-0.46,-3.509%,666477837.00,United States,,22476,Energy,Coal Mining
METCL,Ramaco Resources Inc. 9.00% Senior Notes due 2026,$25.6499,0.1599,0.627%,1351390503.00,United States,,9716,Energy,Coal Mining
MFIC,MidCap Financial Investment Corporation Common Stock,$13.74,0.11,0.807%,896579999.00,United States,2004,174276,Finance,Finance/Investors Services
MFIN,Medallion Financial Corp. Common Stock,$8.34,-0.05,-0.596%,194839822.00,United States,,185230,Finance,Finance: Consumer Services
MGEE,MGE Energy Inc,$74.85,-1.53,-2.003%,2706828245.00,United States,,55851,Energy,Electric Utilities: Central
MGNI,Magnite Inc. Common Stock,$8.59,0.47,5.788%,1176474889.00,United States,,3450074,Consumer Discretionary,Advertising
MGNX,MacroGenics Inc. Common Stock,$5.56,-0.37,-6.239%,344439075.00,United States,2013,622224,Health Care,Biotechnology: Pharmaceutical Preparations
MGPI,MGP Ingredients Inc.,$123.62,0.21,0.17%,2721518530.00,United States,,56605,Consumer Staples,Beverages (Production/Distribution)
MGRC,McGrath RentCorp Common Stock,$101.06,0.67,0.667%,2474453393.00,United States,1984,73546,Consumer Discretionary,Diversified Commercial Services
MGTX,MeiraGTx Holdings plc Ordinary Shares,$5.96,-0.11,-1.812%,354830471.00,United States,2018,92182,Health Care,Biotechnology: Biological Products (No Diagnostic Substances)
MGYR,Magyar Bancorp Inc. Common Stock,$11.11,-0.0501,-0.449%,74312457.00,United States,2006,7236,Finance,Savings Institutions
MIDD,Middleby Corporation (The) Common Stock,$150.25,1.64,1.104%,8053854657.00,United States,,594931,Industrials,Industrial Machinery/Components
MINDP,MIND Technology Inc. Series A 9.00% Series A Cumulative Preferred Stock (DE),$7.93,0.15,1.928%,109344708.00,United States,,3171,Industrials,Industrial Machinery/Components
MINM,Minim Inc. Common Stock,$3.23,0.05,1.572%,152418461.00,United States,,16324,Utilities,Telecommunications Equipment
MIRM,Mirum Pharmaceuticals Inc. Common Stock,$25.85,-0.67,-2.526%,990002654.00,United States,2019,398615,Health Care,Biotechnology: Pharmaceutical Preparations
MITK,Mitek Systems Inc. Common Stock,$11.68,0.27,2.366%,531526444.00,United States,,226786,Technology,Computer peripheral equipment
MKSI,MKS Instruments Inc. Common Stock,$95.92,1.83,1.945%,6413478625.00,United States,1999,662652,Industrials,Industrial Machinery/Components
MKTW,MarketWise Inc. Class A Common Stock,$1.64,-0.105,-6.017%,536809704.00,United States,,179230,Technology,Computer Software: Prepackaged Software
MKTX,MarketAxess Holdings Inc. Common Stock,$236.99,2.74,1.17%,8929173188.00,United States,2004,392282,Finance,Investment Bankers/Brokers/Service
MKUL,Molekule Group Inc. Common Stock,$2.17,0.02,0.93%,73785968.00,United States,2021,25402,Utilities,Environmental Services
MLAB,Mesa Laboratories Inc. Common Stock,$140.20,0.59,0.423%,754877598.00,United States,,34608,Industrials,Industrial Machinery/Components
MLGO,MicroAlgo Inc. Ordinary Shares,$2.3665,-0.1235,-4.96%,103786904.00,United States,2021,12975,Technology,EDP Services
MLKN,MillerKnoll Inc. Common Stock,$20.07,-0.02,-0.10%,1519324830.00,United States,,401555,Consumer Discretionary,Office Equipment/Supplies/Services
MLTX,MoonLake Immunotherapeutics Class A Ordinary Shares,$56.84,0.70,1.247%,3549430924.00,United States,2020,336318,Health Care,Biotechnology: Pharmaceutical Preparations
MLYS,Mineralys Therapeutics Inc. Common Stock,$13.25,0.44,3.435%,541350652.00,United States,2023,170951,Health Care,Biotechnology: Pharmaceutical Preparations
MMAT,Meta Materials Inc. Common Stock,$0.24,-0.0023,-0.949%,114542675.00,United States,,3166803,Technology,Semiconductors
MMLP,Martin Midstream Partners L.P. Limited Partnership,$2.79,0.14,5.283%,108572309.00,United States,2002,114880,Energy,Oil Refining/Marketing
MMSI,Merit Medical Systems Inc. Common Stock,$68.29,-0.42,-0.611%,3935920168.00,United States,,304189,Health Care,Medical/Dental Instruments
MNKD,MannKind Corporation Common Stock,$5.27,0.02,0.381%,1414231809.00,United States,2004,5308661,Health Care,Biotechnology: Pharmaceutical Preparations
MNOV,Medicinova Inc Common Stock,$2.38,-0.025,-1.04%,116730065.00,United States,,9750,Health Care,Biotechnology: Pharmaceutical Preparations
MNRO,Monro Inc. Common Stock,$34.55,-0.06,-0.173%,1085492176.00,United States,1991,290734,Consumer Discretionary,Automotive Aftermarket
MNSB,MainStreet Bancshares Inc. Common Stock,$23.76,-0.16,-0.669%,178790602.00,United States,,11520,Finance,Major Banks
MNSBP,MainStreet Bancshares Inc. Depositary Shares,$22.73,0.00,0.00%,171040000.00,United States,,188,Finance,Major Banks
MNST,Monster Beverage Corporation,$59.01,0.83,1.427%,61814056358.00,United States,,3904846,Consumer Staples,Beverages (Production/Distribution)
MNTK,Montauk Renewables Inc. Common Stock,$9.41,0.00,0.00%,1351856776.00,United States,2021,225398,Utilities,Natural Gas Distribution
MNTX,Manitex International Inc. Common Stock,$5.09,0.04,0.792%,103083255.00,United States,,12207,Technology,Industrial Machinery/Components
MODV,ModivCare Inc. Common Stock,$38.03,-2.03,-5.067%,539313128.00,United States,2003,245079,Consumer Discretionary,Transportation Services
MOFG,MidWestOne Financial Gp Common Stock,$22.91,-0.22,-0.951%,359346168.00,United States,,14111,Finance,Major Banks
MOND,Mondee Holdings Inc. Class A Common Stock,$6.87,-0.09,-1.293%,577028922.00,United States,2021,209749,Consumer Discretionary,Transportation Services
MORF,Morphic Holding Inc. Common Stock,$54.42,0.42,0.778%,2607943538.00,United States,2019,238708,Health Care,Biotechnology: Pharmaceutical Preparations
MORN,Morningstar Inc. Common Stock,$219.00,-0.99,-0.45%,9341160300.00,United States,2005,129683,Finance,Investment Managers
MOVE,Movano Inc. Common Stock,$1.33,0.06,4.724%,55124059.00,United States,2021,62549,Health Care,Biotechnology: Electromedical & Electrotherapeutic Apparatus
MPAA,Motorcar Parts  of America Inc. Common Stock,$8.57,-0.22,-2.503%,167932192.00,United States,,152807,Consumer Discretionary,Auto Parts:O.E.M.
MPB,Mid Penn Bancorp Common Stock,$22.04,-0.48,-2.131%,365272799.00,United States,,35622,Finance,Major Banks
MPWR,Monolithic Power Systems Inc. Common Stock,$524.66,22.49,4.479%,25067205480.00,United States,2004,451980,Technology,Semiconductors
MQ,Marqeta Inc. Class A Common Stock,$5.66,-0.01,-0.176%,3003192140.00,United States,2021,5928837,Technology,Computer Software: Prepackaged Software
MRAM,Everspin Technologies Inc. Common Stock,$9.90,0.10,1.02%,205797032.00,United States,2016,132966,Technology,Semiconductors
MRBK,Meridian Corporation Common Stock,$12.27,-0.03,-0.244%,137151005.00,United States,2017,4951,Finance,Major Banks
